"conversation_id_str","created_at","favorite_count","full_text","id_str","image_url","in_reply_to_screen_name","lang","location","quote_count","reply_count","retweet_count","tweet_url","user_id_str","username"
"2044301017991524575","2026-04-15T06:25:18.000Z","0","Tim RESCUE Pemadam Kebakaran Bengkulu Selatan menindak lanjuti laporan Bapak Nopiri untuk mengevakuasi cincin yang masukke saluran pembuangan air pada hari Rabu, 15 April 2026 pukul 11.00 WIB. 

Berlokasi di Padang Jawi, tepatnya di saluran pembuangan air

https://t.co/Aq0d3MRF7B","2044301017991524575","","","in","","0","0","0","https://x.com/damkarbs/status/2044301017991524575","1390080853569458177","damkarbs"
"2042855980023844944","2026-04-11T06:43:26.000Z","0","Pemadaman dilakukan menggunakan alat pemadam api ringan (APAR) hingga api berhasil dikendalikan.

Menurut keterangan Plt. Kepala Satpol PP dan Damkar Tuban, Sutaji, kebakaran diduga bermula saat proses memasak. Kompor yang terbakar kemudian menyambar blower hingga memicu api.","2042856029214609879","","PortalTuban","in","","0","0","0","https://x.com/PortalTuban/status/2042856029214609879","1940612240513880064","PortalTuban"
"2045033789370601728","2026-04-17T06:57:04.000Z","0","Kebakaran Asrama Polri di Kalideres, 40 Personel Damkar Berjibaku Padamkan Api
https://t.co/oT6nog1VWB","2045033789370601728","","","in","","0","0","0","https://x.com/officialinews_/status/2045033789370601728","132078023","officialinews_"
"2044639146317414422","2026-04-17T01:02:37.000Z","0","@empty__core Ambulans🚑 pemadam kebakaran 🚔polisi MBG bodoamat","2044944585697468430","","empty__core","in","","0","0","0","https://x.com/widala89/status/2044944585697468430","1772735644885786625","widala89"
"2045110450892022175","2026-04-17T12:01:42.000Z","0","Dengan semangat tanpa henti, ribuan pahlawan listrik telah sukses menjaga agar cahaya terus menyala di seluruh Nusantara selama masa Siaga Ramadan dan Idulfitri 1447 H. 
Ratusan posko dan unit pemadam kebakaran siap siaga, didukung teknologi canggih dari Nusantara InnoVision https://t.co/exjwNPSwMB","2045110450892022175","https://pbs.twimg.com/ext_tw_video_thumb/2045110382474436608/pu/img/VwhfHOyfGQXEj5wl.jpg","","in","","0","1","0","https://x.com/PLTGMALEO/status/2045110450892022175","1923989895779147776","PLTGMALEO"
"2044345012138414231","2026-04-15T09:20:07.000Z","1","🚒🔥 **Damkar Hadir untuk Edukasi &amp; Aksi Nyata!** 🔥🚒

Dinas Pemadam Kebakaran dan Penyelamatan  (Damkarmat) turut hadir dalam kegiatan pengawasan di TPA Desa Tambong dengan memberikan edukasi penting kepada masyarakat terkait penanganan kebakaran. https://t.co/FAPbETJ1On","2044345012138414231","https://pbs.twimg.com/ext_tw_video_thumb/2044344808555335680/pu/img/ybHMktKEVz-Ekw6W.jpg","","in","","0","0","0","https://x.com/BwiDamkar/status/2044345012138414231","1620611682069544970","BwiDamkar"
"2044960928756908244","2026-04-17T02:07:33.000Z","0","Kebakaran hebat melanda pabrik isolasi di kawasan Margomulyo, Surabaya, Kamis petang (16/4/2026), mengerahkan puluhan armada hingga robot pemadam untuk menjangkau titik api. #surabaya #breakingnews #kebakaran #damkar #margomulyo https://t.co/BCRg8ZqCI1","2044960928756908244","https://pbs.twimg.com/amplify_video_thumb/2044960864802127872/img/7Q4urgfAyMZ_kZ1S.jpg","","in","","0","0","0","https://x.com/SentraPos/status/2044960928756908244","1973751307778600961","SentraPos"
"2036032059505057891","2026-03-23T10:47:25.000Z","0","Pesawat Air Canada Express dengan nomor penerbangan AC8646 menghantam truk pemadam  kebakaran saat mendarat, mengakibatkan pilot dan kopilot tewas di  tempat.
https://t.co/tNWmAzG5i5","2036032059505057891","","","in","","0","1","0","https://x.com/mediaindonesia/status/2036032059505057891","68930552","mediaindonesia"
"2034249664393011623","2026-03-18T12:44:49.000Z","14","Emang yg gue percaya cuma pemadam kebakaran.","2034249664393011623","","","in","","0","2","2","https://x.com/bakuldimsum_/status/2034249664393011623","1518293169258909696","bakuldimsum_"
"2044078250234916985","2026-04-14T15:52:57.000Z","1","@loanalily jadi polisi atau pemadam kebakaran?","2044081481379918147","","loanalily","in","","1","0","0","https://x.com/2NekoWriter_153/status/2044081481379918147","1938909909359452160","2NekoWriter_153"
"2045071234954576052","2026-04-17T09:25:52.000Z","0","Kebakaran mendadak terjadi di kompleks asrama Polri di kawasan Kalideres, Jakarta Barat, pada Jumat siang, 17 April 2026. Kepulan asap sempat terlihat membumbung, membuat petugas pemadam kebakaran langsung bergerak cepat ke lokasi.

Kepala Dinas Penanggulangan Kebakaran dan https://t.co/cUeBmvIBlk","2045071234954576052","https://pbs.twimg.com/media/HGGNc2DXIAIrlf6.jpg","","in","","0","1","0","https://x.com/VIVAcoid/status/2045071234954576052","41730943","VIVAcoid"
"2035571788697207006","2026-03-22T04:18:28.000Z","95","Militer Israel menyampaikan sebuah rudal Iran telah menghantam Kota Dimona. Lokasi tersebut merupakan tempat fasilitas nuklir berada.

Petugas pemadam kebakaran Israel melaporkan serangan langsung di sebuah kota di Israel selatan itu menyebabkan kerusakan parah pada beberapa https://t.co/4o5pZSMp9B","2035571788697207006","https://pbs.twimg.com/amplify_video_thumb/2035571674444394497/img/_dPS_36a8-kg59TZ.jpg","","in","","2","7","28","https://x.com/inilahdotcom/status/2035571788697207006","46693036","inilahdotcom"
"2044352382017175667","2026-04-15T09:49:24.000Z","0","Abang sama daddy harus sedia no pemadam kebakaran sih","2044352382017175667","","","in","","0","0","0","https://x.com/bibila_44/status/2044352382017175667","2027743326976557056","bibila_44"
"2044401632461586683","2026-04-15T13:06:03.000Z","0","Ada kebakaran+ 2 truk pemadam di sebelah aja ga kedengeran 😭😭😭😭","2044401868269609122","","Jido0_","in","","0","1","0","https://x.com/Jido0_/status/2044401868269609122","916308568466325505","Jido0_"
"2045096181445869697","2026-04-17T21:35:44.000Z","0","@pendapatpribumi @indepenSumatera SEMOGA MENJADI AHLI SYURGA NAK🤲🤲🤲🤲🤲🤲🤲🤲🤲🤲","2045254911005487190","","pendapatpribumi","in","","0","0","0","https://x.com/CoColok_Komporr/status/2045254911005487190","1986937972735057920","CoColok_Komporr"
"2036020391869878728","2026-03-23T10:01:03.000Z","8","Sebuah pesawat jet regional milik Air Canada mengalami kecelakaan setelah menabrak kendaraan pemadam kebakaran di landasan pacu Bandara LaGuardia, New York pada Minggu (22/3/2026) malam waktu setempat. Insiden tersebut menyebabkan dua orang meninggal dunia dan sejumlah lainnya https://t.co/SUU4wZVBKP","2036020391869878728","https://pbs.twimg.com/amplify_video_thumb/2036020138986950657/img/asDvwF5yfkUgk1T5.jpg","","in","","0","0","2","https://x.com/Beritasatu/status/2036020391869878728","154102750","Beritasatu"
"2041036012034695169","2026-04-06T06:11:20.000Z","0","Tim RESCUE Pemadam Kebakaran Bengkulu Selatan menindak lanjuti laporan Bapak Rafi Abdurrahman untuk mengevakuasi biawak yang masuk ke Toko pada hari Senin, 6 April 2026 pukul 12.00 WIB. 

Berlokasi di Toko Rafi Komputer, Jl. Kolonel Berlian, Kota Medan

https://t.co/G1Z1Q4fj2Z","2041036012034695169","","","in","","0","0","0","https://x.com/damkarbs/status/2041036012034695169","1390080853569458177","damkarbs"
"2042828506229543211","2026-04-11T04:54:04.000Z","0","Lingga – Dalam upaya pencegahan dan penanggulangan Kebakaran Hutan dan Lahan (Karhutla), Babinsa Koramil 04/Dabo, Pratu Divi Vikriansyah, yang bertugas di wilayah Desa Pelakak, Desa Jagoh, Kelurahan Raya, dan Desa Sungai Raya, https://t.co/773yLdskHc #taudarikepripedia","2042828506229543211","","","in","","0","0","0","https://x.com/kepripediacom/status/2042828506229543211","1093636091003817984","kepripediacom"
"2043452349243629766","2026-04-12T22:13:00.000Z","0","Tim Pemadam Kebakaran Cilacap berhasil menyelamatkan handphone milik anak berusia 11 tahun yang terjepit di rel kereta. Selain itu, mereka juga memberikan edukasi soal keselamatan di sekitar rel. Penting untuk selalu waspada saat bermain! https://t.co/uEzFN2jZgX","2043452349243629766","https://pbs.twimg.com/media/HFtHTEpbYAAegnm.jpg","","in","","0","0","0","https://x.com/radarmasnetwork/status/2043452349243629766","3245882905","radarmasnetwork"
"2044612242637750639","2026-04-17T03:39:46.000Z","2","@P3gEl Paling bener ke pemadam kebakaran pasti satset dibantu, 

Parcok Melindungi dan Melayani Siapa.???","2044984137229140012","","P3gEl","in","","0","1","0","https://x.com/DazaiOsamu8888/status/2044984137229140012","1952510504959885312","DazaiOsamu8888"
"2045021184102928646","2026-04-17T06:07:00.000Z","0","Kegiatan diawali dengan pemberian materi oleh Tim Pemadam Kebakaran dan Penyelamatan BPBD DIY, meliputi penyebab kebakaran, prosedur evakuasi, hingga tata cara penggunaan Alat Pemadam Api Ringan (APAR).","2045021186564968553","","BPBDDIY","in","","0","1","0","https://x.com/BPBDDIY/status/2045021186564968553","758572219","BPBDDIY"
"2040235447809704171","2026-04-04T01:10:11.000Z","209","🎥 Video dari Israel Hayom yang menunjukkan rudal Iran dengan mudah menghantam Beersheba

Channel 12 Israel: Banyak tim pemadam kebakaran telah dikirim ke lokasi kecelakaan https://t.co/2XvugD8gPo","2040235447809704171","https://pbs.twimg.com/amplify_video_thumb/2040235050269310977/img/G1oV93kIgrgUfXBx.jpg","","in","","1","3","58","https://x.com/SoftWarNews/status/2040235447809704171","2256063276","SoftWarNews"
"2044026441424335085","2026-04-14T12:14:14.000Z","0","Anggota Satgas DAMKAR BS menindaklanjuti laporan warga Batu Kuning untuk membersihkan Jl. Iskandar Baksir yang licin akibat tumpahan minyak pada hari Selasa, 14 April 2026 pukul 17.35 WIB. 

#damkar #pemadamkebakaran #bengkuluselatan #membara

https://t.co/aiySUhHs5d","2044026441424335085","","","in","","0","0","0","https://x.com/damkarbs/status/2044026441424335085","1390080853569458177","damkarbs"
"2041419176980709589","2026-04-11T13:40:50.000Z","0","@kwaeum @jiangheeng tolong panggil pemadam kebakaran ya, dd, buat jaga-jaga kalau nanti tiba-tiba jatuh. siapa tau anginnya mau ngajak ribut.","2042961072383234203","","kwaeum","in","","0","0","0","https://x.com/jiaangheng/status/2042961072383234203","1587739636620591104","jiaangheng"
"2032705165938274410","2026-03-14T06:27:32.000Z","6","Satu Tujuan Semua Selamat di Pelintasan

#Railfriends, bagi petugas pemadam kebakaran, setiap detik adalah pertaruhan nyawa. Mereka terbiasa berlari saat orang lain menjauh dari bahaya. Namun ada satu tempat di mana mereka memilih berhenti sejenak yaitu pelintasan sebidang kereta https://t.co/6xeRqQlCsN","2032705165938274410","https://pbs.twimg.com/amplify_video_thumb/2032704978746486791/img/wvyUIPt37P7LOHBg.jpg","","in","","0","0","1","https://x.com/keretaapikita/status/2032705165938274410","378403540","keretaapikita"
"2044350081923760178","2026-04-15T15:27:57.000Z","0","@unmagnetism Ini mobil pemadam kebakaran kah?","2044437579756654977","","unmagnetism","in","","0","0","0","https://x.com/Racunsensen/status/2044437579756654977","1827952340206546945","Racunsensen"
"2038255393080737893","2026-03-29T14:02:09.000Z","2","Surat kabar Ibrani ""Yediot Ahronot"": 

Akibat serangan rudal Iran hari ini, ada pemandangan yang menunjukkan kerusakan parah pada rumah dan kendaraan para pemukim kolonial. Menurut departemen pemadam kebakaran, perkiraan tim pemadam kebakaran di lapangan menunjukkan bahwa radius https://t.co/vyThBFLZlI","2038255393080737893","https://pbs.twimg.com/media/HElWelsaIAAbeIo.jpg","","in","","0","0","1","https://x.com/bundaathira/status/2038255393080737893","104374118","bundaathira"
"2044639146317414422","2026-04-16T13:53:42.000Z","1","@empty__core Prioritaskan ambulan, lalu pemadam kebakaran. 
Lalu sisanya gimana ?
BAKAR AJA !!! NGGAK BUTUH !!","2044776249462321387","","empty__core","in","","0","0","0","https://x.com/ronniechannelid/status/2044776249462321387","1964255805508816896","ronniechannelid"
"2036157305155363274","2026-03-23T19:05:06.000Z","3","02.04: Terjadi kebakaran sebuah bengkel motor di jalan Pekapuran, Kota Depok. Sudah ada 4 unit mobil pemadam kebakaran masih dalam proses pemadaman. (P. Reza) https://t.co/glQ2o8DVk8","2036157305155363274","https://pbs.twimg.com/amplify_video_thumb/2036157224494702593/img/oi-DEMrk7HrFM2dS.jpg","","in","","0","0","0","https://x.com/RadioElshinta/status/2036157305155363274","121640063","RadioElshinta"
"2044758015115723134","2026-04-16T12:41:21.000Z","0","Main ke pemadam kebakaran seru banget gaes! Naik ke mobil damkar, nyobain jaketnya, terus dikasih tau banyak hal keren tentang kerjaan mereka. Orang-orangnya ramah semua #riyal. Terus aku juga pegang ular (tanganku gemeteran brok 😭) mantap lah gaes pokoknya!!! 👍 https://t.co/SOf2xrgkWF","2044758042844238270","https://pbs.twimg.com/media/HGBwl5pb0AI2asL.jpg","chrimty","in","","0","0","0","https://x.com/chrimty/status/2044758042844238270","1664726724548993026","chrimty"
"2043180646873633002","2026-04-12T04:13:21.000Z","1","Dalam upaya meningkatkan kesadaran serta pengetahuan masyarakat mengenai pentingnya keselamatan, Dinas Pemadam Kebakaran dan Penyelamatan (Damkarmat) Kabupaten Banyuwangi turut berpartisipasi dalam kegiatan Car Free Day (CFD). https://t.co/bfGBZHJWGZ","2043180646873633002","https://pbs.twimg.com/ext_tw_video_thumb/2043180600740478976/pu/img/3LOXSgEqHoz6VCOz.jpg","","in","","0","0","0","https://x.com/BwiDamkar/status/2043180646873633002","1620611682069544970","BwiDamkar"
"2045046039003156965","2026-04-17T08:10:35.000Z","0","@new_thitipoom Aku kira pemadam kebakaran 😭","2045052288763654618","","new_thitipoom","in","","0","0","0","https://x.com/kayin_kayy/status/2045052288763654618","1490893000603435013","kayin_kayy"
"2044639146317414422","2026-04-17T02:56:23.000Z","0","@empty__core 1. Pemadam kebakaran 2. Ambulan, sisanya ga penting","2044973217698463774","","empty__core","in","","0","0","0","https://x.com/wolfiejwu/status/2044973217698463774","1591068574579204096","wolfiejwu"
"2044639146317414422","2026-04-17T00:43:41.000Z","0","@Fian_Fian157 @empty__core Elo yg goblok permanen wahai antek orba . Jawaban gua nyindir tau nggak .Jawaban yg betul ya pemadam kebakaran krn bisa mengancam byk nyawa.Mobil ambulance cuma satu nyawa. Kamu adl contoh dr kegoblokan pemilih 02 ( pki +orba )kaum omon2 &amp; kaum termul . Mandi kembang 7 rupa sana","2044939820947173434","","Fian_Fian157","in","","0","0","0","https://x.com/afif_sanja5092/status/2044939820947173434","2007643116090892288","afif_sanja5092"
"2042541765526458872","2026-04-10T11:07:18.000Z","2","@BebySoSweet Ambulance, dan pemadam kebakaran.. sisanya kecelakaan bagus","2042560046551441748","","BebySoSweet","in","","0","0","0","https://x.com/Yhundhey69/status/2042560046551441748","2022787821048860672","Yhundhey69"
"2043204396369203358","2026-04-13T05:18:19.000Z","0","@Kanseulir Tergantung mana yang penting,ambulan klo kosong ya bisa ntar,pemadam klo gak ada kebakaran yang bisa tungnggu,polisi klo hanya mau pulang ke pos ya bisa ntarobil mbg klo bawa makanan kan takut basi boleh duluan,paham gak son...","2043559386451505564","","Kanseulir","in","","0","0","0","https://x.com/DJshyam1/status/2043559386451505564","2601389630","DJshyam1"
"2044219030488400182","2026-04-15T14:51:33.000Z","3","@RadioElshinta Suruh membuka mulutnya, masukin selang pemadam kebakaran. Buka kran airnya. 10 detik saja. Lalu masukkan ke penjara. Niscaya mereka akan jera.","2044428418960482475","","RadioElshinta","in","","0","1","2","https://x.com/babegini/status/2044428418960482475","226416224","babegini"
"2042482854857490806","2026-04-10T06:00:37.000Z","0","pemadaman dengan peralatan seadanya sambil menunggu kedatangan petugas pemadam kebakaran.

Namun, karena konstruksi bangunan yang didominasi material kayu serta kondisi cuaca panas disertai angin kencang, api dengan cepat membesar dan merambat ke bangunan di sekitarnya.","2042482866513424677","","im_utuhslebew","in","","0","0","0","https://x.com/im_utuhslebew/status/2042482866513424677","1568045311368765441","im_utuhslebew"
"2043906392910901497","2026-04-14T04:22:54.000Z","0","@moonstract Bawa korek ke tempat main air tu gimana kah ? Dia mau main pemadam kebakaran apa ya","2043907827841020032","","moonstract","in","","0","1","0","https://x.com/dewteekinyis/status/2043907827841020032","1244631167808069636","dewteekinyis"
"2045261017022640201","2026-04-17T22:00:00.000Z","0","Dewan Pimpinan Cabang (DPC) Partai Demokrat Kabupaten Lebong bergerak cepat menyalurkan bantuan berupa mie instan, air mineral untuk korban banjir dan longsor di Lebong, Bengkulu, Selasa (7/4/2026).

#ahy #demokrat #peduliberbagi #demokratlebong https://t.co/TBVB50ITd4","2045261017022640201","https://pbs.twimg.com/media/HF7W1VAasAE_hcz.jpg","","in","","0","0","0","https://x.com/Demokrat_TV/status/2045261017022640201","284830933","Demokrat_TV"
"2042607529918894317","2026-04-10T15:07:18.000Z","0","@zakiberkata Dananya kasih damkar aja ke seluruh wilayah indonesia damkar butuh teknologi pemadam kebakaran","2042620443962851747","","zakiberkata","in","","0","0","0","https://x.com/IOS_GrizlyWolf/status/2042620443962851747","769709094999437317","IOS_GrizlyWolf"
"2045093785181516082","2026-04-17T10:55:29.000Z","0","Di Balik Pemadaman Api di Belawan

Di balik proses pemadaman kebakaran di Pelabuhan Belawan, tersimpan cerita dari Nakhoda KT. Hang Tuah III yang terlibat langsung dalam misi pemadaman kapal KM Bintang Mas HSB 7. https://t.co/lTjOVbvRU7","2045093785181516082","https://pbs.twimg.com/amplify_video_thumb/2045093672853917698/img/cBomRTN86c5QlfQb.jpg","","in","","0","0","0","https://x.com/pelindomarine/status/2045093785181516082","2998927579","pelindomarine"
"2044366799417077797","2026-04-15T10:47:15.000Z","0","Setelah mengerahkan 12 unit dan 60 personel, pemadaman api dinyatakan selesai pukul 16.28 WIB","2044366939330617422","","humasjakfire","in","","0","0","0","https://x.com/humasjakfire/status/2044366939330617422","555862521","humasjakfire"
"2043246703147626573","2026-04-12T08:35:50.000Z","1","https://t.co/3PhKrbZMOH 
Petugas pemadam kebakaran harus disejahterakan mereka berjuang menyelamatkan rumah harta benda nyawa penduduk yg rumahnya sedang kebakaran dan mrk membutuhkan keterampilan dan skill khusus utk menyelamatkan orang lain dan dirinya sendiri dari kobaran api","2043246703147626573","","","in","","0","0","0","https://x.com/jakarta7268/status/2043246703147626573","1881092445049634816","jakarta7268"
"2043678825666781594","2026-04-13T13:12:56.000Z","8","GOKIL KEREN BANGET. Kemaren syuting di Singapore, sekarang pakai pemadam kebakaran beneran. 
#TerikatJanji #TerikatJanjiEp9","2043678825666781594","","","in","","0","0","2","https://x.com/KimbapS9262/status/2043678825666781594","2029429013912178688","KimbapS9262"
"2042628607407984663","2026-04-10T16:02:06.000Z","0","@junyoungbby Temen gue pernah kekunci di kamar mandi, berakhir manggil pemadam kebakaran buat bukain 😭","2042634232603017653","","junyoungbby","in","","0","1","0","https://x.com/NewbieOneIt/status/2042634232603017653","1347681279316148225","NewbieOneIt"
"2045197701013533147","2026-04-17T17:48:24.000Z","0","BIKIN GEGER‼️

Komplotan begal sadis kepada petugas pemadam kebakaran akhirnya tertangkap saat asik pesta dihotel😠 https://t.co/9PdpegT3wI","2045197701013533147","https://pbs.twimg.com/amplify_video_thumb/2045197628489785344/img/dWYsH_ZDcTWZal6D.jpg","","in","","0","0","0","https://x.com/obrolannetizen/status/2045197701013533147","1790962911743197184","obrolannetizen"
"2042855542469824843","2026-04-11T06:41:30.000Z","1","Dinas Pemadam Kebakaran dan Penyelamatan(Damkarmat) Kabupaten Banyuwangi melalui Bidang Pencegahan melaksanakan kegiatan edukasi dan sosialisasi kebencanaan sebagai upaya meningkatkan pemahaman serta kesiapsiagaan sejak dini.

📍 Al-Husniyyah Islamic Boarding School Muncar https://t.co/g2NY3gjFYI","2042855542469824843","https://pbs.twimg.com/ext_tw_video_thumb/2042855345442426880/pu/img/XUevaSsyaQjZT8JH.jpg","","in","","0","0","0","https://x.com/BwiDamkar/status/2042855542469824843","1620611682069544970","BwiDamkar"
"2045141703867392269","2026-04-17T14:05:53.000Z","1","Polisi bergerak cepat! Tim gabungan berhasil mengamankan 5 orang tersangka yang terlibat dalam aksi pembegalan petugas Pemadam Kebakaran di kawasan Pluit beberapa waktu lalu.
​Masing-masing pelaku ternyata punya peran berbeda: https://t.co/XDtDg0SLrk","2045141703867392269","https://pbs.twimg.com/ext_tw_video_thumb/2045141610368040960/pu/img/wjdLOHOr4fZwc1LF.jpg","","in","","0","0","0","https://x.com/MENUJU_2029/status/2045141703867392269","1370390874203459591","MENUJU_2029"
"2044194996354723972","2026-04-14T23:24:15.000Z","0","Kejelasan tanggung jawab penyediaan perlengkapan teknis pemadam kebakaran desa diatur dalam draf pembangunan Ciamis. Kami menjamin keamanan birokrasi pedesaan didukung oleh  sarana proteksi yang sah dan legal.

Kemenkum Jabar - Asep Sutandar.","2044195058833076324","","kemenkumjabar","in","","0","0","0","https://x.com/kemenkumjabar/status/2044195058833076324","1177725229","kemenkumjabar"
"2042787129416388804","2026-04-11T02:09:43.000Z","0","3. Aku mempersiapkan diri menghadapi keadaan darurat di rumah dengan mengetahui nomor-nomor penting seperti pemadam kebakaran, rumah sakit, dan polisi. Selain itu, aku juga menyimpan nomor tersebut di tempat yang mudah diakses.
Aku memahami jalur keluar rumah agar bisa segera","2042787147326067007","","Ningyiziuo","in","","0","1","0","https://x.com/Ningyiziuo/status/2042787147326067007","2354095274","Ningyiziuo"
"2042450744037851220","2026-04-10T03:52:58.000Z","2","Puluhan petugas pemadam kebakaran dikerahkan untuk mengatasi kebakaran besar yang melanda Velodrome di kawasan Olympic Park Velodrome, Rio de Janeiro, pada Rabu (9/4/2026).

Sekitar 80 personel bersama 20 unit mobil pemadam diterjunkan untuk menjinakkan api, baik dari dalam https://t.co/EVUuSNLTNC","2042450744037851220","https://pbs.twimg.com/amplify_video_thumb/2042450650764869632/img/ALSCIO-BqJLYhZp1.jpg","","in","","0","0","0","https://x.com/inilahdotcom/status/2042450744037851220","46693036","inilahdotcom"
"2043008411500270010","2026-04-11T16:48:57.000Z","0","KACAU HIU BANGKIT, BUKAN PEMADAM KEBAKARAN DOANG YG BANGKIT.","2043008411500270010","","","in","","0","0","0","https://x.com/eingning/status/2043008411500270010","1354539848","eingning"
"2036069200674849107","2026-03-23T13:15:00.000Z","1","Pesawat Air Canada Tabrak Truk Pemadam Kebakaran di AS, Pilot dan Kopilot Dilaporkan Tewas

https://t.co/yjLTqsquKm","2036069200674849107","","","in","","0","0","0","https://x.com/KompasTV/status/2036069200674849107","71436318","KompasTV"
"2044368799437324700","2026-04-15T10:54:38.000Z","0","Gak usah bawa bawa Pemadam Kebakaran boss. Mau dibandingin dari segi apapun gak nyambung.

Gak usah harus nya bisa ini harus nya bisa itu, harus nya MBG Stop!!","2044368799437324700","","","in","","0","0","0","https://x.com/eckohatake/status/2044368799437324700","101145065","eckohatake"
"2044639146317414422","2026-04-17T04:40:35.000Z","6","@empty__core Kasih llewat ambulan terlebih dahulu karna kalo kasih pemadam kebakaran terlebih dahulu gak bisa karna udah terlanjur kebakaran juga dan polisi terakhir dan MBG di kempesin aja bannya","2044999438645731625","","empty__core","in","","0","0","0","https://x.com/NSleuth50644/status/2044999438645731625","1777674389141766144","NSleuth50644"
"2043667254500544842","2026-04-13T13:05:29.000Z","0","@caleztial ketik reg spasi move on kirim ke kantor pemadam kebakaran","2043676953065193712","","caleztial","in","","0","0","0","https://x.com/jurnalperasa/status/2043676953065193712","1910756470817513472","jurnalperasa"
"2042243534062014931","2026-04-10T11:31:36.000Z","0","@HabisNontonFilm Pandji ngasih ide buat mereka nih agak laen. Scene film selanjutnya nanti kehidupan pemadam kebakaran. Kita tahu kan berjasanya pemadam kebakaran di Indonesia ini terlalu random. 😁","2042566159917350921","","HabisNontonFilm","in","","0","1","0","https://x.com/KloppGerman/status/2042566159917350921","1055406276023209984","KloppGerman"
"2045211125806141708","2026-04-17T18:44:06.000Z","1","Kemenkum Jabar dorong Pemkab Karawang pastikan akses pemadam kebakaran ke dalam gang sempit. Keselamatan warga di  area padat penduduk harus jadi prioritas utama dalam draf RDTR yang dibahas.

Kemenkum Jabar - Asep Sutandar","2045211719384088848","","kemenkumjabar","in","","0","0","0","https://x.com/kemenkumjabar/status/2045211719384088848","1177725229","kemenkumjabar"
"2043522859507810440","2026-04-13T02:53:11.000Z","0","🚛 Satu Solusi untuk Semua Kebutuhan Bisnis Anda! 

Toyota Hilux Rangga hadir dengan beragam konversi kendaraan di GIICOMVEC 2026 — dari Cool Box logistik, unit pemadam kebakaran, hingga pendukung program MBG (Makanan Bergizi Gratis). 

#ToyotaHiluxRangga
 https://t.co/S0L5V9ZznD","2043522859507810440","","","in","","0","0","0","https://x.com/eddie_toyota/status/2043522859507810440","1225036397653848064","eddie_toyota"
"2042538627897659641","2026-04-11T02:22:03.000Z","0","@theultramilkkk kepake buat cosplay pemadam kebakaran","2042790248355348960","","theultramilkkk","in","","0","0","0","https://x.com/OblivionWav20/status/2042790248355348960","1869985465031602176","OblivionWav20"
"2042817266006573180","2026-04-11T04:09:24.000Z","0","Kebakaran hebat terjadi di sebuah gudang pabrik plastik di Margaasih pada Sabtu (11/4) sekitar pukul 04.30 WIB. 
 Api dengan cepat membesar hingga melalap bangunan, sementara petugas pemadam kebakaran langsung melakukan penanganan di lokasi.  #kebakaran https://t.co/fY3LG6bWxZ","2042817266006573180","https://pbs.twimg.com/amplify_video_thumb/2042816979539779584/img/aAHQx0XXd2ScCiVL.jpg","","in","","0","0","0","https://x.com/inilahkoran_id/status/2042817266006573180","243040577","inilahkoran_id"
